{
  "schema_version": "v5.defect-artifact.1",
  "id": "scale-ai__swe-atlas-tw__scaleapi__swe-atlas__pr-14",
  "benchmark_name": "scale-ai__swe-atlas-tw",
  "scope": "task_specific",
  "task_names": [
    "task-6902ef3ab97fe23e2ad271f9",
    "task-6902ef3ab97fe23e2ad27202",
    "task-6902ef3ab97fe23e2ad27207",
    "task-6902ef3ab97fe23e2ad27209",
    "task-6902ef3ab97fe23e2ad27211",
    "task-6902ef3ab97fe23e2ad27214",
    "task-6902ef3ab97fe23e2ad27223",
    "task-6902ef3ab97fe23e2ad2722e",
    "task-6902ef3ab97fe23e2ad2723f",
    "task-6902ef3ab97fe23e2ad27245",
    "task-6902ef3ab97fe23e2ad27247",
    "task-6902ef3ab97fe23e2ad27248",
    "task-6902ef3ab97fe23e2ad2724b",
    "task-6902ef3ab97fe23e2ad2724e",
    "task-6902ef3ab97fe23e2ad27256",
    "task-6902ef3ab97fe23e2ad2725c",
    "task-6902ef3ab97fe23e2ad2725e",
    "task-6902ef3ab97fe23e2ad27260",
    "task-6902ef3ab97fe23e2ad27262",
    "task-6902ef3ab97fe23e2ad27264",
    "task-6902ef3ab97fe23e2ad27265",
    "task-6902ef3ab97fe23e2ad27266",
    "task-6902ef3ab97fe23e2ad27267",
    "task-6902ef3ab97fe23e2ad27268",
    "task-6902ef3ab97fe23e2ad2726a",
    "task-6902ef3ab97fe23e2ad2726d",
    "task-6902ef3ab97fe23e2ad27273",
    "task-6902ef3ab97fe23e2ad27274",
    "task-6902ef3ab97fe23e2ad27275",
    "task-6902ef3ab97fe23e2ad27276",
    "task-6902ef3ab97fe23e2ad27277",
    "task-6902ef3ab97fe23e2ad27279",
    "task-6902ef3ab97fe23e2ad2727a",
    "task-6902ef3ab97fe23e2ad2727c",
    "task-6902ef3ab97fe23e2ad2727d",
    "task-6902ef3ab97fe23e2ad27280",
    "task-6902ef3ab97fe23e2ad27281",
    "task-6902ef3ab97fe23e2ad27283"
  ],
  "resolution": "fixed",
  "title": "Prewarm Go dependencies for TW tasks",
  "summary": "Thirty-eight SWE-Atlas TW Go tasks needed their pinned Go module graphs prewarmed at image build time so closed-runtime agent/verifier execution could resolve dependencies offline instead of failing under GOPROXY=off.",
  "canonical_source_url": "https://github.com/scaleapi/SWE-Atlas/pull/14",
  "evidence_urls": [
    "https://github.com/scaleapi/SWE-Atlas/pull/14",
    "https://github.com/scaleapi/SWE-Atlas/pull/14/files"
  ],
  "audit_level": "L2",
  "first_reported_at": "2026-07-17T17:36:26Z",
  "last_reviewed_at": "2026-07-22T00:07:30.850Z",
  "decision_note": "L2 audit: merged PR #14 body states the TW scope, lists 38 affected tasks, reports all 38 completed with zero errors, and the diff removes docker_image while adding go mod download plus GOPROXY/GOSUMDB=off across the changed TW task Dockerfiles/task.toml files. Existing PR #11 covers the general network restriction, but not this Go dependency prewarm root cause."
}
