{
  "schema_version": "v5.defect-artifact.1",
  "id": "deep-swe__datacurve-ai__deep-swe__issue-105",
  "benchmark_name": "deep-swe",
  "scope": "benchmark_level",
  "task_names": [],
  "resolution": "found",
  "title": "DeepSWE v1.1 grading defects and test infrastructure bypasses",
  "summary": "DeepSWE verifiers restore only listed test.patch files, leaving submission-controlled test hooks and support files able to rewrite failing reports into full reward.",
  "canonical_source_url": "https://github.com/datacurve-ai/deep-swe/issues/105",
  "evidence_urls": [
    "https://github.com/datacurve-ai/deep-swe/issues/105",
    "https://github.com/tokenless-ai/envcheck-findings/tree/post/2026-10-grader-defects/posts/2026-10-grader-defects",
    "https://github.com/tokenless-ai/envcheck-findings/blob/post/2026-10-grader-defects/posts/2026-10-grader-defects/findings/mutable-test-hooks/README.md",
    "https://github.com/tokenless-ai/envcheck-findings/blob/post/2026-10-grader-defects/posts/2026-10-grader-defects/findings/mutable-test-hooks/REPRODUCE.md",
    "https://github.com/tokenless-ai/envcheck-findings/blob/post/2026-10-grader-defects/posts/2026-10-grader-defects/findings/mutable-test-infrastructure/README.md",
    "https://github.com/datacurve-ai/deep-swe/blob/0b9fabbb63b9104d678fe965e1632f2dd9eaa2ea/tasks/adaptix-name-mapping-aliases/tests/grader.py"
  ],
  "audit_level": "L3",
  "first_reported_at": "2026-10-02T20:27:50Z",
  "last_reviewed_at": "2026-10-04T00:05:19Z",
  "decision_note": "L3-equivalent public reproduction audit. The issue is attributed to current DeepSWE commit 0b9fabbb63b9104d678fe965e1632f2dd9eaa2ea and provides stored inputs, expected outputs, and reproduction commands. The representative mutable-test-hooks finding runs DeepSWE's own verifier for adaptix-name-mapping-aliases with a submitted tests/conftest.py report hook: the hook patch receives reward 1 with 44/44 feature tests while an empty control receives reward 0. The same shared trust-boundary mechanism is shown for LangChain, Scriggo, and sql-formatter examples. This run counts only that shared mutable test infrastructure/report-hook root cause as a benchmark-level DeepSWE defect; the other indexed write-ups are not separately counted from this aggregate issue."
}
