{
  "schema_version": "v5.defect-artifact.1",
  "id": "livecodebench__livecodebench__livecodebench__issue-158",
  "benchmark_name": "livecodebench",
  "scope": "benchmark_level",
  "task_names": [],
  "resolution": "found",
  "title": "Code execution: generations disqualified by the input-echo guard are dropped from the pass@1 denominator instead of being scored False",
  "summary": "LiveCodeBench code-execution metrics drop generations caught by the input-echo guard from pass@1 denominators instead of scoring them false.",
  "canonical_source_url": "https://github.com/LiveCodeBench/LiveCodeBench/issues/158",
  "evidence_urls": [
    "https://github.com/LiveCodeBench/LiveCodeBench/issues/158",
    "https://github.com/LiveCodeBench/LiveCodeBench/blob/main/lcb_runner/evaluation/compute_code_execution_metrics.py",
    "https://github.com/LiveCodeBench/LiveCodeBench/blob/main/lcb_runner/benchmarks/code_execution.py",
    "https://github.com/LiveCodeBench/LiveCodeBench/blob/main/lcb_runner/evaluation/compute_scores.py"
  ],
  "audit_level": "L3",
  "first_reported_at": "2026-09-23T20:17:26Z",
  "last_reviewed_at": "2026-09-24T00:06:58.055Z",
  "decision_note": "L3-equivalent public reproduction audit. The issue cites current LiveCodeBench code paths and reports running the real extraction, check_correctness sandbox, insert_output_evaluation, and score aggregation: mixed valid/echoed generations produce a shorter graded_list, so one correct literal plus four echo answers scores pass@1=1.0 instead of 0.2. Existing LiveCodeBench artifacts cover packaging and other harness issues, not this denominator-drop root cause. No fix PR is linked, so resolution is found."
}
